{
  "economic_thesis": "After coin-specific volatility compresses relative to its own prior baseline, a persistent idiosyncratic three-bar shock can reflect a temporary inventory displacement rather than durable common-market information. Requiring multi-bar direction agreement and penalizing rough paths should isolate dislocations that recoil over the next week, while per-bar median residualization and an exactly neutral book remove a common crypto-direction forecast.",
  "expected_regime_roles": {
    "bear": "Long recently oversold compressed-shock coins and short recently overbought peers without taking positive market beta.",
    "bull": "Short overextended positive idiosyncratic shocks and own negative dislocations while exact neutrality avoids a disguised bull bet.",
    "chop": "Inventory-driven cross-sectional overshoots should recoil most directly; combined-chop attribution must still be positive empirically.",
    "long_sleeve": "Own the strongest returned recoil scores generated by durable negative residual shocks after compression.",
    "short_sleeve": "Short the lowest returned recoil scores generated by durable positive residual shocks after compression.",
    "stress": "Weekly turnover, 0.36 gross, eight or more names per side, and a 0.025 cap limit scale; profitability remains a noncompensatory empirical gate."
  },
  "family_id": "t08-compressed-shock-recoil-v1",
  "falsifier": "Reject if this exact no-control core fails any official central-development threshold: net Sharpe at least 0.75, positive annualized return, Calmar at least 0.40, maximum drawdown at most 0.30, doubled-cost Sharpe at least 0.35, positive doubled-cost return, trial-adjusted probability positive at least 0.90, at least four of six profitable folds, positive-quarter fraction at least 0.55, worst-regime Sharpe at least -0.25, and at least three positive regime Sharpes. Also require strictly positive return and Sharpe in bull, bear, and chop; positive long-bull, short-bear, and combined-chop attribution; both sleeves use the 0.01 active-exposure threshold and have active-bar fraction at least 0.10, mean gross exposure at least 0.01, and executed notional at least 1000 USDT; at least 70% of declared neighbors profitable with median neighbor Sharpe at least 0.50; positive-PnL concentration at most 0.40; complete scheduled A5 score coverage; positive pooled score IC; and at least four positive fold ICs. Controls, neighbors, ablations, private data, and sign inversion cannot rescue any failure.",
  "mechanism": "Every seven days, subtract the same-bar pure-crypto median from each of 126 completed 8-hour returns. Compare 21 pre-shock bars with the prior 84-bar volatility baseline; score the latest three-bar idiosyncratic shock in the opposite direction only after two-of-three sign agreement, median-component durability, and path-roughness shrinkage; final-rank once at A5; construct a broad equal-dollar exactly neutral 0.36-gross book from only returned scores.",
  "parameter_ranges": {
    "bar_interval_hours": [8],
    "baseline_volatility_bars": [72, 84, 96],
    "compression_ratio_ceiling": [0.9, 1.0, 1.1],
    "compression_ratio_floor": [0.4, 0.45, 0.5],
    "compression_volatility_bars": [18, 21, 24],
    "gross_target": [0.36],
    "history_return_bars": [126],
    "maximum_symbol_exposure": [0.025],
    "minimum_direction_agreement": ["2/3"],
    "minimum_positions_per_side": [8],
    "minimum_valid_symbols": [24],
    "rebalance_interval_bars": [21],
    "risk_policy_variants": ["no-control"],
    "seed": [20260801],
    "selected_fraction_per_side": ["1/5"],
    "shock_bars": [3],
    "shock_saturation_z": [2.0, 2.5, 3.0]
  },
  "parent_family_id": "volatility-dispersion-release-v1",
  "registered_at_utc": "2026-07-16T22:22:32Z",
  "risk_policy_plan": "Run only the exact disabled no-control first-pivot reference. Declared neighbors remain dormant until it passes every non-neighborhood official and stricter gate, then run solely to adjudicate stability. No risk control, stop, private ticket, or submission is authorized until the complete gate passes. Controls cannot repair a failed mechanism.",
  "schema_version": 1,
  "selection_metric": "Noncompensatory eligibility first: every no-control, regime, role, sleeve, stability, concentration, A5 coverage, and score-IC gate must pass.",
  "team_id": "team-08"
}
