{
  "schema_version": 1,
  "team_id": "team-05",
  "family_id": "team05-liquidity-depth-migration-v1",
  "parent_family_id": "team05-up-down-capture-convexity-v1",
  "registered_at_utc": "2026-07-18T12:10:18Z",
  "mechanism": "On a 168-hour Unix-epoch schedule, use exactly 126 past-closed eight-hour bars for each A6-eligible native-crypto contract. At each timestamp divide unsigned log(high/low) by contemporaneous cross-sectional quote-volume share. Compare each symbol's median impact over a 105-bar baseline with a disjoint 21-bar recent window, rank log(baseline/recent) as final long desirability, expose that complete finite score dictionary once to A5, and select equal-weight top and bottom sleeves in an exactly dollar-balanced 0.36-gross book.",
  "economic_thesis": "A contract whose realized price range contracts relative to its share of native-crypto trading activity is gaining effective market depth; a contract whose range expands per unit of activity is losing depth. Improving-depth assets should absorb two-sided flow more efficiently and prove more resilient than deteriorating-depth assets across rising, falling, and directionless markets. This is a temporal liquidity-capacity migration signal, not a return-direction, signed-flow, funding, price-anchor, or shock-reversal signal.",
  "expected_regime_roles": {
    "bull": "Improving-depth longs should accommodate expanding participation with less impact, while deteriorating-depth shorts should lag healthy liquid leaders.",
    "bear": "Deteriorating-depth shorts should be more vulnerable to withdrawal of liquidity, while improving-depth longs should be relatively resilient.",
    "chop": "Because the statistic is unsigned and direction-free, persistent two-sided depth improvement should favor longs over deteriorating shorts during repeated rotations.",
    "stress": "Cross-sectional depth deterioration should identify fragile shorts; exact dollar balance, broad equal sleeves, 0.36 gross, and 4% caps bound exposure without an optional risk overlay.",
    "long_sleeve": "Top A5-returned scores with higher median raw depth improvement than the selected shorts; required to contribute positively in bull.",
    "short_sleeve": "Bottom A5-returned scores with lower median raw depth improvement than the selected longs; required to contribute positively in bear."
  },
  "falsifier": "Reject the exact final no-control LDM core and mark Team 05 DNF if it is insolvent, lacks required evidence, or fails any causality, A5, A6, return, Sharpe, cost, drawdown, Calmar, quarter, fold, trial-adjusted-confidence, regime, role, sleeve, concentration, depth-migration, or score-IC gate in qualification_thresholds.json. Controls, sign flips, neighbors, same-family replacements, and further pivots cannot rescue failure.",
  "parameter_ranges": {
    "bar_interval_hours": [8],
    "decision_interval_hours": [168],
    "history_bars": [126],
    "baseline_bars": [105],
    "recent_bars": [21],
    "maximum_latest_staleness_hours": [12],
    "minimum_symbols": [12],
    "minimum_valid_baseline_bars": [95],
    "minimum_valid_recent_bars": [19],
    "volume_share_floor": [1e-5],
    "maximum_log_range": [0.7],
    "maximum_abs_log_impact_ratio": [4.0],
    "minimum_score_span": [0.5],
    "selection_fraction": [0.2],
    "minimum_side_symbols": [5],
    "maximum_side_symbols": [8],
    "minimum_raw_separation": [0.1],
    "target_gross": [0.36],
    "maximum_symbol_weight": [0.04],
    "maximum_abs_net": [1e-12]
  },
  "selection_metric": "No within-family selection occurs: the one exact final-pivot no-control core is eligible only if every noncompensatory development, A5, regime, role, sleeve, concentration, and LDM mechanism gate passes.",
  "risk_policy_plan": "Root risk_policy.json is byte-identical to risk_policies/no-control.json. No volatility target, drawdown brake, position or time stop, turnover control, side scaling, combined policy, ablation, parameter neighbor, sign flip, replacement, or later pivot is authorized before or after the result."
}
