{
  "economic_thesis": "When the causal common-market path and cross-sectional breadth are coherent, slow information diffusion and inventory adjustment produce residual continuation; when the path is inefficient and breadth fragmented, temporary liquidity imbalances produce residual reversal. Realized perpetual funding identifies crowded expensive positioning and should improve long/short carry without forecasting funding.",
  "expected_regime_roles": {
    "bear": "Negative causal market direction increases short gross while persistent residual losers and high-funding contracts populate the short sleeve; short attribution is expected positive.",
    "bull": "Positive causal market direction increases long gross while persistent uncrowded residual winners populate the long sleeve; long attribution is expected positive.",
    "chop": "Low persistence shifts the score toward short-horizon residual reversal, near-neutral side budgets, and realized-funding carry; combined portfolio return is expected positive.",
    "long_sleeve": "Long the highest composite ranks, favoring persistent residual strength in coherent markets, oversold residuals in fragmented markets, and low/negative realized funding; gross remains materially active in every state.",
    "short_sleeve": "Short the lowest composite ranks, favoring persistent residual weakness in coherent markets, overbought residuals in fragmented markets, and high positive realized funding; gross remains materially active in every state.",
    "stress": "Residualization and inverse-volatility sizing limit common-beta concentration; organizer-owned volatility targeting and drawdown brakes seek approximately flat-to-modestly-positive behavior and bounded tails, without claiming crisis alpha."
  },
  "falsifier": "Reject the mechanism if fewer than four of six chronological folds show the preregistered positive trend-high-persistence/reversal-low-persistence IC interaction, or funding fails to reduce net carry paid in at least four folds. Reject economically if fewer than four folds are profitable after base costs, required regime/sleeve signs or doubled-cost viability fail, or fewer than 70% of declared neighbors are profitable; no aggregate metric compensates.",
  "family_id": "team-02-causal-crowding-residual-persistence-v1",
  "mechanism": "At each daily rebalance, use only transaction closes and realized funding through t-8h for the current point-in-time Top-40. Remove a rolling median-market beta, rank medium/fast residual trend and short residual reversal, blend them with a smooth causal market-efficiency/breadth persistence state, then add a realized-funding carry rank. Long the top ranks and short the bottom ranks with inverse-volatility sleeve weights; smoothly tilt but never extinguish either side using past common-market direction.",
  "parameter_ranges": {
    "beta_lookback_days": [
      15,
      20,
      25
    ],
    "direction_scale": [
      1.0,
      1.5,
      2.0
    ],
    "fast_residual_days": [
      7,
      10
    ],
    "feature_lag_bars": [
      1
    ],
    "funding_lookback_days": [
      3,
      7,
      14
    ],
    "funding_weight": [
      0.1,
      0.2,
      0.3
    ],
    "gross_target": [
      0.8,
      0.9,
      1.0
    ],
    "maximum_side_tilt": [
      0.05,
      0.075,
      0.1
    ],
    "minimum_valid_history_fraction": [
      0.8,
      0.9
    ],
    "persistence_breadth_threshold": [
      0.2,
      0.3,
      0.4
    ],
    "persistence_efficiency_threshold": [
      0.2,
      0.3,
      0.4
    ],
    "rebalance_bars": [
      3,
      6
    ],
    "residual_reversal_days": [
      1,
      2,
      3
    ],
    "selected_fraction_per_side": [
      0.2,
      0.25,
      0.3
    ],
    "slow_residual_days": [
      15,
      20,
      25
    ],
    "slow_trend_weight": [
      0.5,
      0.65,
      0.8
    ],
    "transition_width": [
      0.1,
      0.15
    ],
    "volatility_lookback_days": [
      15,
      20,
      25
    ]
  },
  "parent_family_id": null,
  "registered_at_utc": "2026-07-15T19:30:13Z",
  "risk_policy_plan": "Freeze the selected signal before a full 2^3 factorial of 20-day 35% volatility target, 10/20/27.5% drawdown brakes, and 0.25 one-way turnover limit. Evaluate none, individuals, pairs, and combined under base and doubled costs. Keep same-boundary reentry false; position/time stops disabled. Retain only a subset that improves drawdown or 5% tail loss at least 10%, loses at most 0.10 Sharpe, and preserves every gate.",
  "schema_version": 1,
  "selection_metric": "Non-compensatory gate pass first; then lexicographically maximize positive-fold count, worst-fold net Sharpe, median-fold net Sharpe, doubled-cost Sharpe, and Calmar; then minimize maximum drawdown and turnover, with bytewise candidate_id as final tie-break. Require the causal sign tests and profitable-neighbor fraction before selection.",
  "team_id": "team-02"
}
